{
  "$schema": "http://json-schema.org/draft-07/schema#",
  "$id": "https://cpokuru.github.io/CoreRDK-Broadband-Platform/schemas/flash-layout.schema.json",
  "title": "RDK-B Core Broadband Flash Layout by Partition",
  "description": "Per-profile logical flash partition breakdown, answering 'what consumes the flash minimum'. Sibling file to memory-footprint.schema.json, kept separate from hw-compat.schema.json so layout can be refined as real bring-up data comes in without touching the CPU/RAM/flash/peripheral spec file. Partition classes only — exact byte offsets and OEM-specific bootloader/calibration layout are out of scope (see Hardware Compatibility Specification Section 3.3).",
  "type": "object",
  "required": ["specVersion", "profileId", "measured", "partitions"],
  "properties": {
    "specVersion": {
      "type": "string",
      "description": "Version of this JSON schema (semantic version), e.g. \"1.0\"."
    },
    "profileId": {
      "type": "string",
      "description": "Matches the profileId in the corresponding hw-compat.schema.json file for this profile."
    },
    "measured": {
      "type": "boolean",
      "description": "True if partition sizes below are measured from an actual built image; false if sizes are architectural estimates/proposals pending real bring-up measurement."
    },
    "referenceDevice": {
      "type": "string",
      "description": "Optional. Device the layout was measured or proposed against, e.g. \"BPI-R4 (MediaTek MT7988, Filogic)\"."
    },
    "lastMeasured": {
      "type": "string",
      "format": "date",
      "description": "Optional. ISO-8601 date (YYYY-MM-DD) of the most recent measurement or estimate revision."
    },
    "totalFlashMB": {
      "type": "number",
      "description": "Optional. Total flash in MB this layout is sized against; should be >= the profile's storage.minFlashMB in hw-compat."
    },
    "partitions": {
      "type": "array",
      "description": "Logical partition classes, in typical flash-offset order. Empty when measured is false and no estimate has been proposed yet.",
      "items": {
        "type": "object",
        "required": ["partition", "purpose", "sizeMB"],
        "properties": {
          "partition": { "type": "string", "description": "Logical partition class name, e.g. \"Bootloader\", \"Kernel (A)\", \"Rootfs (B)\", \"Persistent/Config\", \"Calibration\"." },
          "purpose": { "type": "string", "description": "What this partition holds and why it's required." },
          "sizeMB": {
            "anyOf": [{ "type": "number" }, { "type": "string", "enum": ["TBD"] }],
            "description": "Size in MB, or \"TBD\" if not yet sized."
          },
          "requiredForOTA": { "type": "boolean", "description": "Optional. True if this partition class is required to support A/B OTA firmware upgrade." },
          "owner": { "type": "string", "enum": ["core-rdk-b", "oem", "vendor"], "description": "Optional. Who defines/writes the content of this partition — Core RDK-B, the OEM, or the SoC/component vendor." }
        }
      }
    },
    "notes": {
      "type": "string",
      "description": "Optional. Free-text notes, e.g. explaining estimate basis or why a profile's layout is unmeasured."
    }
  }
}
