{
  "$schema": "https://cpokuru.github.io/CoreRDK-Broadband-Platform/schemas/flash-layout.schema.json",
  "specVersion": "1.0",
  "profileId": "ethwan-wifi-router",
  "measured": true,
  "referenceDevice": "BPI-R4 (MediaTek MT7988, Filogic)",
  "lastMeasured": "2026-09-16",
  "totalFlashMB": 4096,
  "partitions": [
    {
      "partition": "bl2",
      "purpose": "Early boot stage (BL2 A). Raw boot payload, not filesystem-measurable.",
      "sizeMB": 4,
      "requiredForOTA": true,
      "owner": "vendor"
    },
    {
      "partition": "fip",
      "purpose": "Firmware Image Package (FIP A). Raw boot payload.",
      "sizeMB": 2,
      "requiredForOTA": true,
      "owner": "vendor"
    },
    {
      "partition": "boot_a",
      "purpose": "Active BootFS (VFAT) \u2014 kernel image + DTB. Measured 7.5 MiB used of 16 MiB (47%).",
      "sizeMB": 16,
      "requiredForOTA": true,
      "owner": "core-rdk-b"
    },
    {
      "partition": "rootfs_a",
      "purpose": "Active RootFS (ext4) containing Core RDK-B components. Measured 401 MiB used of 958 MiB filesystem capacity (45%; base 398.10 MiB + overlay 2.39 MiB), production-style image.",
      "sizeMB": 1024,
      "requiredForOTA": true,
      "owner": "core-rdk-b"
    },
    {
      "partition": "bl2_b",
      "purpose": "Standby BL2 for A/B fallback.",
      "sizeMB": 4,
      "requiredForOTA": true,
      "owner": "vendor"
    },
    {
      "partition": "fip_b",
      "purpose": "Standby FIP for A/B fallback.",
      "sizeMB": 2,
      "requiredForOTA": true,
      "owner": "vendor"
    },
    {
      "partition": "boot_b",
      "purpose": "Passive BootFS (VFAT), valid filesystem present. Not independently measured \u2014 passive-slot content not mounted during this capture.",
      "sizeMB": 16,
      "requiredForOTA": true,
      "owner": "core-rdk-b"
    },
    {
      "partition": "rootfs_b",
      "purpose": "Passive RootFS (ext4), valid filesystem present. Not independently measured \u2014 passive-slot content not mounted during this capture; filesystem existence alone does not confirm a complete bootable standby image.",
      "sizeMB": 1024,
      "requiredForOTA": true,
      "owner": "core-rdk-b"
    },
    {
      "partition": "nvram",
      "purpose": "Shared persistent configuration (PSM/TR-181), single partition, no separate A/B. Measured 4.6 MiB used of 14 MiB capacity (36%).",
      "sizeMB": 16,
      "requiredForOTA": false,
      "owner": "core-rdk-b"
    },
    {
      "partition": "crash_a",
      "purpose": "Slot-A crash/debug capture. Not mounted during this capture; not independently measured.",
      "sizeMB": 8,
      "requiredForOTA": false,
      "owner": "core-rdk-b"
    },
    {
      "partition": "crash_b",
      "purpose": "Slot-B crash/debug capture. Not mounted during this capture; not independently measured.",
      "sizeMB": 8,
      "requiredForOTA": false,
      "owner": "core-rdk-b"
    },
    {
      "partition": "reserved",
      "purpose": "Reserved, not currently allocated to a specific use.",
      "sizeMB": 16,
      "requiredForOTA": false,
      "owner": "core-rdk-b"
    },
    {
      "partition": "dac",
      "purpose": "DAC partition \u2014 new RDK-B flash requirement, reserved for a future device-class-specific use case. Present and allocated on this build despite that scoping.",
      "sizeMB": 32,
      "requiredForOTA": false,
      "owner": "core-rdk-b"
    }
  ],
  "notes": "Partition names, allocations, and filesystem types are measured directly from the BPI-R4 reference device (fdisk/proc evidence) \u2014 see Hardware Compatibility Specification Section 3.7.1. Total allocated across all 13 partitions is 2,172 MiB, well within the 4,096 MB (4 GB) minFlashMB floor (Section 3, CRF-001) with room to spare, consistent with the 8 GB production recommendation. MAC address storage has no partition here \u2014 on this device it is derived from the serial number at boot rather than stored in flash (board-level limitation; see Section 3.7.1). Passive-slot partitions (boot_b, rootfs_b, crash_a, crash_b) have confirmed filesystems but were not independently measured in this capture (not mounted). rootfs_a's 401 MiB reflects the latest production-style measurement (build rdk8-1.0.0_20260916), superseding an earlier 383 MiB figure from a prior measurement pass."
}
