{
  "$schema": "https://cpokuru.github.io/CoreRDK-Broadband-Platform/schemas/flash-layout.schema.json",
  "specVersion": "1.0",
  "profileId": "ext-easymesh",
  "measured": true,
  "referenceDevice": "BPI-R4 (MediaTek MT7988, Filogic) \u2014 tri-band Wi-Fi 7 EasyMesh extender",
  "lastMeasured": "2026-09-02",
  "totalFlashMB": 4096,
  "partitions": [
    {
      "partition": "bl2",
      "purpose": "Early boot stage (BL2 A). Raw boot payload, present.",
      "sizeMB": 4,
      "requiredForOTA": true,
      "owner": "vendor"
    },
    {
      "partition": "fip",
      "purpose": "Firmware Image Package (FIP A). Raw boot payload, present.",
      "sizeMB": 2,
      "requiredForOTA": true,
      "owner": "vendor"
    },
    {
      "partition": "boot_a",
      "purpose": "Active BootFS (VFAT) \u2014 kernel image + DTB. Measured 7.44 MiB used of 15.95 MiB (47%).",
      "sizeMB": 16,
      "requiredForOTA": true,
      "owner": "core-rdk-b"
    },
    {
      "partition": "rootfs_a",
      "purpose": "Active RootFS (ext4) containing Core RDK-B components; no WAN stack loaded for this profile. Measured 221.44 MiB used of 957.42 MiB filesystem capacity (25%; base 220.96 MiB + overlay 0.50 MiB), clean production-representative image (BUILD_TYPE=dev label present, but no development toolchains found in the filesystem).",
      "sizeMB": 1024,
      "requiredForOTA": true,
      "owner": "core-rdk-b"
    },
    {
      "partition": "bl2_b",
      "purpose": "Standby BL2 for A/B fallback.",
      "sizeMB": 4,
      "requiredForOTA": true,
      "owner": "vendor"
    },
    {
      "partition": "fip_b",
      "purpose": "Standby FIP for A/B fallback.",
      "sizeMB": 2,
      "requiredForOTA": true,
      "owner": "vendor"
    },
    {
      "partition": "boot_b",
      "purpose": "Passive BootFS (VFAT), populated.",
      "sizeMB": 16,
      "requiredForOTA": true,
      "owner": "core-rdk-b"
    },
    {
      "partition": "rootfs_b",
      "purpose": "Passive RootFS \u2014 allocated, no filesystem present (uninitialized). Slot B is an upgrade target that has not yet received a firmware image, not a populated standby.",
      "sizeMB": 1024,
      "requiredForOTA": true,
      "owner": "core-rdk-b"
    },
    {
      "partition": "nvram",
      "purpose": "Shared persistent configuration (PSM/TR-181), single partition, no separate A/B. Measured 0.28 MiB used of 13.74 MiB capacity (3%).",
      "sizeMB": 16,
      "requiredForOTA": false,
      "owner": "core-rdk-b"
    },
    {
      "partition": "crash_a",
      "purpose": "Slot-A crash/debug capture \u2014 allocated, no filesystem present (uninitialized).",
      "sizeMB": 8,
      "requiredForOTA": false,
      "owner": "core-rdk-b"
    },
    {
      "partition": "crash_b",
      "purpose": "Slot-B crash/debug capture \u2014 allocated, no filesystem present (uninitialized).",
      "sizeMB": 8,
      "requiredForOTA": false,
      "owner": "core-rdk-b"
    },
    {
      "partition": "reserved",
      "purpose": "Reserved \u2014 allocated, no filesystem present (uninitialized).",
      "sizeMB": 16,
      "requiredForOTA": false,
      "owner": "core-rdk-b"
    },
    {
      "partition": "dac",
      "purpose": "DAC partition \u2014 allocated, no filesystem present (uninitialized).",
      "sizeMB": 32,
      "requiredForOTA": false,
      "owner": "core-rdk-b"
    }
  ],
  "notes": "Partition names, allocations, and filesystem types are measured directly from a Filogic tri-band extender reference device \u2014 see Hardware Compatibility Specification Section 3.7.1. Total allocated across all 13 partitions is 2,172 MiB, well within the 4,096 MB (4 GB) minFlashMB floor (Section 3, CRF-002) with room to spare. rootfs_a's 221.44 MiB confirms the extender genuinely needs less flash than the gateway (no WAN stack), not more. An earlier measurement on a separate, dev-SDK-contaminated image showed 1.7 GiB used (Go/Rust/LLVM/GCC/headers/debug packages, over 1 GiB of toolchain alone); that figure is superseded by this clean result. MAC address storage has no partition here \u2014 see ethwan-wifi-router.flash-layout.json notes for the shared board-level explanation."
}
